author,name,queries,LLM1,LLM_RAG1,LLM2,LLM_RAG2,LLM3,LLM_RAG3
Михаил Лермонтов,Родина,"Напиши краткий анализ стихотворения Михаила Лермонтова ""Родина"" на основе его размера, рифмы и основной мысли","Стихотворение Михаила Лермонтова ""Родина"" написано четырёхстопным ямбом, что придаёт ему мелодичность и плавность. Основная мысль произведения заключается в сложных, противоречивых чувствах поэта по отношению к родине. 

1. **Размер**: Четырёхстопный ямб создаёт ритмическую структуру, которая подчёркивает внутренний конфликт лирического героя. Этот размер позволяет выразить глубину и многогранность чувств, которые испытывает поэт.

2. **Рифма**: Стихотворение имеет перекрёстную рифму (абаб), что усиливает динамику текста и помогает акцентировать внимание на ключевых моментах, где раскрываются различные грани отношения поэта к родине.

3. **Основная мысль**: В ""Родине"" Лермонтов выражает двойственное чувство: любовь и ненависть к России. Он признаёт величие и красоту своей страны, но одновременно осознаёт её недостатки и социальные проблемы. Это противоречие отражено в строках: 
   - ""Люблю отчизну я, но странною любовью..."" — здесь подчёркивается сложность и неоднозначность чувств.
   - ""И может быть, куда она губительней..."" — это свидетельствует о разочаровании и осознании тёмных сторон родной земли.

Таким образом, стихотворение ""Родина"" является примером глубокого и многослойного осмысления темы родины в русской поэзии, где личные переживания переплетаются с общественными реалиями.","Стихотворение Михаила Лермонтова ""Родина"" написано четырехстопным хореем с чередованием мужских и женских рифм (ABAB), что создает плавный и ритмичный рисунок. Это придает тексту особую мелодичность и легкость, делая его легко воспринимаемым.

Основная мысль стихотворения заключается в противоречии между разумным пониманием и чувственным восприятием родины. Лермонтов выражает любовь к России, которая отличается от традиционной, интеллектуально обоснованной любви. Он говорит о ""странной любви"", не объясняя её причины, но подчеркивая, что она связана с конкретными образами и ощущениями: степей, лесов, рек, деревень и простых сцен из жизни крестьян. Эти образы наполнены глубокой эмоциональной силой, которая не поддается логическому объяснению. В этом проявляется романтическая идея о связи человека с природой и его корнями, где чувства и интуиция играют более значительную роль, чем рациональное осмысление.","Стихотворение Михаила Лермонтова ""Родина"" написано в форме ямба, четырёхстопного размера, что придаёт ему плавность и мелодичность. Рифма в стихотворении перекрестная (ABAB), что создаёт гармоничное звучание и удерживает внимание читателя на ключевых образах и идеях.

Основная мысль стихотворения выражена в противопоставлении любви к родине и осознания её недостатков. Лермонтов пишет о том, что, несмотря на все трудности и несовершенства, он всё равно любит свою родину, потому что она часть его самого. Это выражено в строках:

> Как ни бывал я влюблён,
> Какие сердце ни знало,
> Но нет милее уголка
> На свете, чем мой уголок!

Автор подчёркивает, что даже если бы он нашёл более прекрасные места, его родина всегда будет занимать особое место в его сердце. Стихотворение отражает глубокую связь поэта с его родиной, несмотря на его разочарование в ней. Лермонтов показывает, что любовь к родине не зависит от её совершенства, а основана на личных воспоминаниях и чувствах.","Стихотворение Михаила Лермонтова ""Родина"" написано четырехстопным ямбом, что придает тексту ровный и размеренный ритм, создавая ощущение спокойствия и умиротворенности. Рифма в стихотворении — перекрестная (абаб), что добавляет музыкальности и гармоничности звучанию. 

Основная мысль произведения заключается в том, что любовь к родине у поэта имеет необычную, не объяснимую причинами природу. Он любит не за славу, историю или покой, а за простые и обыденные вещи: ""холодное молчанье"" степей, ""колыханье"" лесов, ""дрожащие огни"" деревень. Для него родина — это не абстрактное понятие, а живая картина природы и быта, которая вызывает в нем теплые и ностальгические чувства. 

Таким образом, стихотворение Лермонтова демонстрирует, что истинная любовь к родине может проявляться в самых простых и незаметных вещах, которые часто остаются незамеченными другими.","Стихотворение Михаила Лермонтова ""Родина"" написано в размере четырехстопного ямба, что придает ему торжественность и величие. Строгая рифмовка — abab — создает ритмичность и упорядоченность, подчеркивая внутреннюю борьбу и противоречия, которые испытывает лирический герой.

Основная мысль стихотворения заключается в сложных чувствах, которые испытывает поэт по отношению к своей родине. С одной стороны, он любит ее и признает ее красоту, о чем свидетельствуют строки: ""Как дикий цвет hill в пустыне,/ Как солнца луч в тесной темнице"". С другой стороны, он осознает, что Россия — это не только прекрасный край, но и место, где ему неуютно из-за социальных и политических ограничений, что выражено фразой: ""И, с детских лет, привыкнув к оковам,/ Я гнаться не хочу за мнимыми свободами"".

Таким образом, стихотворение отражает глубокую личную связь поэта с родиной, которая одновременно и любима, и вызывает чувство угнетения.","Стихотворение Михаила Лермонтова ""Родина"" написано четырехстопным ямбом, что придает тексту плавность и мелодичность. Рифма в стихотворении перекрестная (ABAB), что создает ритмическую устойчивость и помогает выделить ключевые образы и мысли.

Основная мысль стихотворения заключается в том, что любовь к родине не всегда связана с материальными или историческими аспектами. Лермонтов говорит о том, что его чувство к родине — это нечто интуитивное и глубоко личное, не объяснимое разумом. Он описывает природные и бытовые детали, которые вызывают у него ностальгию и эмоциональную привязанность: степи, леса, реки, деревни и избы. Эти элементы служат символами родной земли, вызывающими у поэта особое чувство дома и умиротворения.

Таким образом, стихотворение показывает, что любовь к родине может быть не только патриотической, но и интимной, основанной на личном опыте и воспоминаниях. Это делает ее более универсальной и близкой читателю, способствуя пониманию и сопереживанию."
Эдуард Асадов,Я могу тебя очень ждать...,"Проанализируй ""Я могу тебя очень ждать"" Эдуарда Асадова на основе его размера, рифмы и основной мысли","Стихотворение Эдуарда Асадова ""Я могу тебя очень ждать"" написано в размере четырехстопного хорея, что создает ритмическую легкость и плавность. Оно имеет перекрестную рифму (АБАБ), что придает стихотворению мелодичность и позволяет четко выделить ключевые образы и эмоции.

Основная мысль стихотворения заключается в выражении глубокой любви и терпеливого ожидания возлюбленной. Поэт передает чувство преданности и готовности ждать, несмотря на любые препятствия:

1. ""Я могу тебя очень ждать,  
   Даже если ты далеко.""  
2. ""Могу я тебя забывать,  
   Когда сердце твоё со мной?""

Эти строки подчеркивают силу чувств, способных преодолеть расстояния и время. Стихотворение передает не только эмоциональное состояние героя, но и его уверенность в том, что любовь сможет победить все трудности.","Стихотворение Эдуарда Асадова ""Я могу тебя очень ждать"" написано в размере четырехстопного ямба, что придает ему плавность и мелодичность. Это создает ощущение уверенности и решимости, подчеркивая готовность говорящего ждать и следовать за любимым человеком.

Что касается рифмы, то стихотворение следует схеме ABAB, что делает его звучание более гармоничным и запоминающимся. Такая структура способствует созданию четкой и последовательной композиции, где каждое четверостишие завершается рифмой, подводя итог определенной мысли или эмоции.

Основная мысль стихотворения заключается в глубокой преданности и готовности жертвовать ради любимого человека. Говорящий готов ждать его долгие годы, преодолевать любые препятствия и отдавать все, что у него есть. Он подчеркивает, что хочет знать, что его усилия не напрасны и что его чувства взаимны. В центре внимания — вопрос о подлинности и значимости этих чувств, что делает стихотворение особенно трогательным и эмоциональным.

Строки, выражающие эту основную мысль, можно выделить следующим образом:

1. ""Я могу тебя очень ждать, / Долго-долго и верно-верно,""
2. ""Только знать бы, что все не зря,""
3. ""Что люблю тебя не напрасно!""

Эти строки подчеркивают главную идею стихотворения — необходимость уверенности в том, что усилия и чувства не напрасны.","Стихотворение Эдуарда Асадова ""Я могу тебя очень ждать"" написано в форме свободного стиха, что означает отсутствие строгой метрической структуры и рифмовки. Это позволяет поэту сосредоточиться на содержании и эмоциональной глубине текста.

1. **Размер**: Стихотворение не следует какой-либо конкретной метрической схеме, поэтому его размер можно охарактеризовать как свободный. Это дает возможность использовать разнообразные длины строк и ритмические паттерны для усиления эмоционального воздействия.

2. **Рифма**: В стихотворении используется нерегулярная рифмовка, где некоторые строки рифмуются между собой (например, ""жду"" и ""тебя""), тогда как другие остаются без рифмы. Такой подход добавляет музыкальности и создает ощущение естественности, что соответствует теме ожидания и надежды.

3. **Основная мысль**: Основная идея стихотворения заключается в силе любви и терпения. Поэт выражает уверенность в том, что даже если время ожидания кажется долгим, любовь способна преодолеть все преграды. Это видно из строк, таких как ""Я могу тебя очень ждать / Не знаю, сколько времени пройдет"", где подчеркивается готовность ждать и вера в то, что встреча состоится.

В целом, стихотворение передает чувство надежды и веры в силу чувств, которые могут преодолеть любые трудности.","Стихотворение Эдуарда Асадова ""Я могу тебя очень ждать"" написано в свободном стихе, что позволяет автору выражать свои чувства без строгих ограничений метрики. Это создает ощущение искренности и непосредственности в передаче эмоций.

**Размер:** Стихотворение состоит из восьмистишных строф (октав), что придает ему определенную структуру и ритмичность. Однако, отсутствие строгой метрики делает каждый стих уникальным, подчеркивая индивидуальность авторского подхода.

**Рифма:** Рифмовка в стихотворении смешанная, с элементами перекрестной и парной рифмы. Например, в первой строфе рифмуются строки 1 и 3, 2 и 4, 5 и 7, 6 и 8. Такая организация рифмы добавляет музыкальности и плавности чтению.

**Основная мысль:** В центре стихотворения стоит тема преданности и готовности жертвовать ради любимого человека. Поэт говорит о своей способности ждать долго и верно, идти за любимым по любым путям, отдавать все, что у него есть, лишь бы это было нужно и ценно для другого. Основная идея заключается в том, что истинная любовь требует самоотдачи и уверенности в взаимности чувств. Асадов задается вопросом о значимости своих действий и желания знать, что они не будут напрасными, что подчеркивает глубину и неуверенность в ответных чувствах.","Стихотворение Эдуарда Асадова ""Я могу тебя очень ждать"" написано в размере четырехстопного хорея, что создает ритмическую плавность и легкость в восприятии. Основная рифма — перекрестная (абаб), что придает стиху динамичность и подчеркивает эмоциональную насыщенность текста.

Основная мысль стихотворения заключается в силе любви и терпении, которые способны преодолеть любые расстояния и время. Поэт использует повторение фразы ""я могу тебя очень ждать"", чтобы усилить чувство преданности и надежды. Это подчеркивает веру в то, что даже самые долгие ожидания могут завершиться встречей и счастьем.

Примеры строк, иллюстрирующих эти элементы:

1. **Размер**:  
   ""Я могу тебя очень ждать,  
    В любую пору и час.""

2. **Рифма**:  
   ""В любую пору и час —  
    С тобой встречу я.""

3. **Основная мысль**:  
   ""Я могу тебя очень ждать,  
    Пока звезды не погаснут.""

Эти строки показывают, как размер и рифма поддерживают основную тему стихотворения, делая его глубоким и трогательным.","Стихотворение Эдуарда Асадова «Я могу тебя очень ждать» написано четырехстопным ямбом, что придает ему плавность и ритмичность. Размер стихотворения составляет 14 строк, что соответствует форме сонета, хотя сам Асадов не указывает на это явно. Это создает ощущение завершенности и глубины.

Что касается рифмы, то в стихотворении используется перекрестная рифма (ABAB CDCD EFEF GHGH), что добавляет музыкальности и гармонии тексту. Такая структура позволяет акцентировать внимание на ключевых моментах и эмоциях, выраженных в каждой строфе.

Основная мысль стихотворения заключается в безграничной преданности и готовности жертвовать ради любимого человека. Поэт подчеркивает свою способность ждать, следовать за любимым и отдавать ему все, что у него есть, лишь бы это было взаимно. Основное послание – это уверенность в том, что любовь и преданность не должны быть напрасными, и что важно, чтобы любимый человек чувствовал ту же глубину чувств. Слова «что все не зря» повторяются на протяжении всего стихотворения, усиливая эту идею и делая её центральной темой произведения."
