author,name,queries,LLM1,LLM_RAG1,LLM2,LLM_RAG2,LLM3,LLM_RAG3
Анна Ахматова,А ты думал - я тоже такая...,"Проанализируй Анны Ахматовой ""А ты думал - я тоже такая"" на основе его размера, рифмы и основной мысли","Анна Ахматова в своем стихотворении ""А ты думал - я тоже такая"" использует свободный размер, что придает тексту естественность и живость. Стихотворение не следует строгим метрическим рамкам, что позволяет автору выразить глубокие эмоции и внутренние переживания без ограничений традиционных форм.

Что касается рифмы, то здесь она нерегулярная и асимметричная, что создает ощущение спонтанности и неожиданности. Это подчеркивает непредсказуемость человеческих чувств и отношений, которые являются центральной темой произведения.

Основная мысль стихотворения заключается в разочаровании и осознании того, что за внешней оболочкой скрываются сложные внутренние переживания. Ахматова пишет:

```
А ты думал - я тоже такая,
И молчала, как все, и шептала,
Как все, в тёмном углу - о другом?
```

Эти строки показывают, что героиня не соответствует стереотипам и ожиданиям окружающих. Она скрывает свою истинную сущность, которая отличается от общепринятых норм. В дальнейшем стихотворении Ахматова раскрывает глубину своих чувств и мыслей, показывая, что за внешним фасадом может скрываться богатый внутренний мир.

Вот еще несколько строк, которые передают основную идею:

```
Я - не ты, не твой человек.
Я - не та, кто в толпе шепчет о любви.
```

Эти строки подчеркивают уникальность и непохожесть героини на других, а также ее стремление к искренности и autenticity.","Стихотворение Анны Ахматовой ""А ты думал - я тоже такая"" написано в четырехстопном хорее, что придает ему четкость и ритмичность. Это создает ощущение уверенности и решимости, подчеркивая твердую позицию автора.

**Рифма:** Стихотворение построено по схеме ABAB, что обеспечивает плавность и гармоничность звучания. Рифмы здесь точные и ясные, что усиливает эмоциональное воздействие текста.

**Основная мысль:** Основная идея стихотворения заключается в том, что автор отвергает образ слабой и покорной женщины, который может быть навязан обществом или мужчинами. Она утверждает свою силу и независимость, заявляя, что не будет бросаться в ноги или просить о прощении. Вместо этого она обещает, что никогда не вернется к тому, кто её недооценивал. Ахматова использует образы ""копыта гнедого коня"", ""наговорной воды"" и ""душистого платка"", чтобы подчеркнуть своё намерение сохранить достоинство и не поддаваться на манипуляции. Клятва ""ангельским садом"", ""чудотворной иконой"" и ""пламенным чадом"" ночей подчеркивает глубину её чувств и решимость.

Таким образом, стихотворение передает мощное послание о самоутверждении и независимости женщины, которая отказывается быть жертвой обстоятельств.","Анна Ахматова в стихотворении ""А ты думал - я тоже такая"" использует свободный размер, что позволяет ей гибко выражать сложные эмоции и внутренние переживания. Рифма в стихотворении нерегулярная, она меняется от строфы к строфе, создавая ощущение естественности и спонтанности. Это подчеркивает непредсказуемость и глубину чувств, которые испытывает лирическая героиня.

Основная мысль стихотворения заключается в том, что внешняя оболочка человека может не соответствовать его внутреннему миру. Лирическая героиня отвергает предположение о своей легкости и поверхностности, показывая, что за внешней простотой скрываются сложные переживания и душевная глубина. Строка ""А ты думал - я тоже такая"" становится ключевой, она провоцирует читателя переосмыслить свои представления о человеке, которого он знает.

Релевантные строки:

1. ""А ты думал - я тоже такая?""
2. ""Как зеркало твоё лицо"".
3. ""Но я - не ты, не ты, не ты"".

Эти строки подчеркивают контраст между внешним образом и внутренним миром лирической героини, демонстрируя её независимость и самобытность.","Стихотворение Анны Ахматовой ""А ты думал - я тоже такая"" написано в четырёхстопном ямбе, что придаёт ему ритмическую стройность и лёгкость. Это позволяет поэту создавать плавное и выразительное звучание, которое подчёркивает эмоциональную глубину текста.

### Рифма:
Рифма в стихотворении перекрестная (ABAB), что создаёт музыкальную гармонию и подчёркивает внутреннюю связь между строками. Такая схема рифмования усиливает впечатление целостности и завершённости произведения.

### Основная мысль:
Основная мысль стихотворения заключается в отказе от прошлого и нежелании поддаваться на попытки возобновления прежних отношений. Поэтесса отвергает идею о том, что она может измениться ради кого-то другого или вернуться к прежним чувствам. Она обещает не поддаваться мольбам и не использовать старые способы привлечения внимания, такие как слезы или магические обряды. Вместо этого она клянётся, что её отношения с этим человеком закончились навсегда и она не вернётся к нему, даже если он будет молить об этом. Это выражено в строках: ""Но клянусь тебе ангельским садом, / Чудотворной иконой клянусь, / И ночей наших пламенным чадом - / Я к тебе никогда не вернусь.""

Таким образом, стихотворение является мощным выражением решимости и независимости, демонстрирующим силу женской воли и отказ от зависимости от прошлых отношений.","Стихотворение Анны Ахматовой ""А ты думал - я тоже такая"" написано в размере четырехстопного ямба, что придает ему плавность и мелодичность. Оно состоит из восьми строк, каждая из которых рифмуется по схеме abababcc. Такая рифмовка подчеркивает внутреннюю связь и развитие мысли, выраженной в стихотворении.

Основная мысль стихотворения заключается в разоблачении мифа о том, что все женщины одинаковы, особенно в отношении эмоциональных переживаний и жизненных испытаний. Ахматова показывает, что за внешней оболочкой может скрываться сложный внутренний мир, полный противоречий и тайн. В первых строках она говорит о том, что не стоит предполагать о другом человеке, что он такой же, как и ты, и что за видимой простотой может скрываться глубокая душевная сложность:

```
А ты думал - я тоже такая,
Как у всех, без страха и без лжи?
Я жила, как будто бы в тюрьме,
И знала, что никто не услышит.
```

Эти строки передают чувство изоляции и одиночества, которое может испытывать человек, даже если внешне он кажется спокойным и сдержанным. Стихотворение подчеркивает важность понимания и уважения к индивидуальности каждого человека, а не к упрощенным стереотипам.","Стихотворение Анны Ахматовой ""А ты думал - я тоже такая"" написано в размере четырёхстопного анапеста, что создаёт ритмическую плавность и подчёркивает эмоциональную глубину текста. Рифма в стихотворении перекрёстная (ABAB), что придаёт ему особую мелодичность и гармоничность.

Основная мысль стихотворения заключается в том, что героиня разрушает стереотип о себе как о женщине, готовой на любые жертвы ради любимого человека. Она отвергает традиционные представления о женской слабости и покорности, заявляя, что не станет мольбой и слезами добиваться внимания мужчины. Вместо этого она обещает вернуться к своей независимости и внутренней силе, клянясь в этом ангельским садом, чудотворной иконой и пламенным чадом ночей, проведённых вместе. Это подчёркивает её решимость и внутреннюю непоколебимость, а также подчеркивает, что её любовь и привязанность не зависят от внешних проявлений чувств."
