author,name,queries,LLM1,LLM_RAG1,LLM2,LLM_RAG2,LLM3,LLM_RAG3
Федор Тютчев,Весенняя гроза,"Анализ стихотворения Федора Тютчева ""Весенняя гроза"" на основе его размера, рифмы и основной мысли","Стихотворение Фёдора Тютчева ""Весенняя гроза"" написано четырёхстопным хореем с перекрестной рифмой (ABAB). Размер стихотворения создаёт ощущение плавности и ритмичности, что подчёркивает динамику весенней грозы.

Основная мысль произведения заключается в противопоставлении природных сил и человеческого восприятия. Тютчев описывает грозу как мощное и разрушительное явление, но в то же время он подчёркивает её красоту и очищающую силу. В первой строфе поэт говорит о том, как гроза ""буйствует"", ""шумит"" и ""громоздит"" тучи, создавая образ бурной стихии. Однако во второй строфе он переходит к более спокойному описанию, где гроза уже предстаёт как ""чистый свет"", ""последний дождик"" и ""радуга"". Это противопоставление подчёркивает идею о том, что даже в самых суровых проявлениях природы есть гармония и красота.

Рифма (ABAB) добавляет музыкальность стихотворению, делая его звучание более выразительным. Весь текст наполнен метафорами и эпитетами, что усиливает образность и эмоциональную глубину произведения:

1. ""Как будто буйный, шумный поток...""
2. ""И вот уж льётся последний дождик...""
3. ""И радуга над ним сверкает...""

Эти строки ярко передают динамику и красоту весенней грозы, показывая её как нечто одновременно могущественное и очаровательное.","Стихотворение Фёдора Тютчева ""Весенняя гроза"" написано в четырёхстопном ямбе, что создаёт ритмичность и плавность, соответствующую весеннему настроению. Рифма в стихотворении перекрестная (ABAB), что добавляет музыкальности и помогает удерживать внимание читателя на ключевых образах и моментах.

Основная мысль стихотворения заключается в восхищении природой и её силой. Автор передаёт радость и восторг от наблюдения за весенней грозой, подчеркивая, как она становится частью живого диалога с природой. Гроза предстаёт как естественный процесс, который гармонично вписывается в окружающую среду: ""Все вторит весело громам"". 

Тютчев использует яркие образы, такие как ""пыль летит"", ""перлы дождевые"", ""нити золотит"", чтобы создать ощущение присутствия и полного погружения в атмосферу весенней грозы. В финале стихотворения автор вводит мифологический элемент, сравнивая небо с кубком, из которого богиня Геба наливает вино, что символизирует божественную силу и красоту природных явлений. Это усиливает впечатление от стихотворения и подчёркивает его глубокую философскую основу.","Стихотворение Федора Тютчева ""Весенняя гроза"" написано в форме ямбического триметра, что придает ему плавность и естественность. Размер стихотворения составляет 14 строк, что соответствует классическому формату sonnet, хотя сам Тютчев не следовал строгой сонетной структуре. Рифма в стихотворении организована по схеме ABAB CDCD EFEF GG, что создает гармоничное звучание и подчеркивает ритмические особенности текста.

Основная мысль стихотворения заключается в противопоставлении силы природы и хрупкости человеческой жизни. Весенняя гроза, с ее мощью и разрушительной силой, становится метафорой для жизненных испытаний, которые человек должен преодолеть. Однако, несмотря на всю свою суровость, гроза также приносит обновление и очищение, что символизирует возможность возрождения и обновления после трудностей. 

Рассмотрим некоторые ключевые строки, которые иллюстрируют эти идеи:

1. ""Как часто, в тишине ночной, / Мелькнет молния, / Как часто, в час угрюмый, / Загремит гром!"" - здесь описывается внезапность и сила природных явлений, которые вызывают как страх, так и восхищение.

2. ""И все живое / Блаженно дремлет; / Но вдруг / Порыв ветра..."" - эта фраза показывает, как даже самые спокойные моменты могут быть нарушены внезапными и мощными изменениями.

3. ""Но вдруг / Порыв ветра... / И грянул гром..."" - здесь подчеркивается внезапность и неотвратимость природных катаклизмов.

4. ""Но вдруг / Порыв ветра... / И грянул гром, / И все кругом / Засверкало..."" - этот переход от тишины к грохоту и сверканию подчеркивает мощь природы и ее способность изменять окружающий мир.

5. ""И все кругом / Засверкало, / И полилась / Сквозь ливень / Лазурь..."" - здесь природа предстает как источник обновления и света, несмотря на свою первоначальную грозную силу.

Таким образом, стихотворение ""Весенняя гроза"" является глубоким размышлением о взаимосвязи человека и природы, где природа выступает как символ жизненных испытаний и одновременно как источник надежды и обновления.","Стихотворение Федора Тютчева ""Весенняя гроза"" написано в ямбическом размере, что придает ему легкость и плавность. Структура стихотворения состоит из четырехстопного ямба, что создает ритмичность и гармонию. Рифма в стихотворении перекрестная (ABAB), что добавляет музыкальности и связности текста.

Основная мысль произведения заключается в восхищении природой и её силой. Тютчев использует образы весенней грозы, чтобы передать красоту и могущество природных явлений. Он описывает грозу как игру, где ""гром резвится и играет"", подчеркивая её динамичность и жизненную энергию. В то же время, автор улавливает гармонию между природными явлениями: ""Все вторит весело громам"". 

Тютчев также акцентирует внимание на том, как гроза влияет на окружающий мир: ""Вот дождик брызнул, пыль летит"", ""И солнце нити золотит"". Это указывает на преобразующую силу природы, которая, несмотря на свою мощь, способна приносить обновление и красоту. Основная идея стихотворения — это восхищение природой, её силой и красотой, а также её способностью приносить радость и вдохновение. 

Финальная строка: ""Ты скажешь: ветреная Геба, / Кормя Зевесова орла, / Громокипящий кубок с неба, / Смеясь, на землю пролила."" — завершает образ весенней грозы как божественного дара, символизирующего обновление и плодородие.","Стихотворение Федора Тютчева ""Весенняя гроза"" написано в форме ямба, что придаёт ему плавность и естественность, соответствующую картине природы. Размер стихотворения — 14 строк, что составляет одну строфу, характерную для баллады, но здесь она служит для выражения единого эмоционального состояния.

Рифма в стихотворении — перекрёстная (ABAB), что создаёт ощущение гармонии и упорядоченности. Такой тип рифмовки подчеркивает связь между различными элементами природы и человеческими чувствами.

Основная мысль стихотворения заключается в том, что природа, даже в её разрушительных проявлениях, является источником жизни и обновления. Весенняя гроза, с её громом и молнией, символизирует очищение и возрождение. Тютчев пишет:

```
Какая мощь в этом громе,
Какая сила в этих звуках!
```

Эти строки подчеркивают динамику и энергию природы, которая, несмотря на свою силу, несет в себе обновление и надежду. Основная идея заключается в том, что природные явления, хотя и внушают страх, являются неотъемлемой частью жизненного цикла и приносят новую жизнь:

```
И, утомлённый, засыпает
Под шум весенних водопадов.
```

Здесь подчеркивается идея успокоения и примирения с природой, которая после бурного проявления возвращается к своему спокойному состоянию. Стихотворение отражает философское восприятие природы как силы, способной как разрушать, так и обновлять.","Стихотворение Федора Тютчева ""Весенняя гроза"" написано в размере четырёхстопного хорея, что придаёт ему живой и подвижный характер, соответствующий описанию весенней грозы. Рифма в стихотворении перекрестная (ABAB), что создаёт гармоничное и плавное звучание.

Основная мысль стихотворения заключается в изображении весенней грозы как символа обновления и пробуждения природы. Тютчев использует яркие образы и метафоры, чтобы передать радостное и мощное воздействие грозы на окружающий мир. Например, гром сравнивается с ""громокипящим кубком"", который ""смеясь, на землю пролила"", что подчеркивает его жизнеутверждающую силу и красоту.

Стихотворение также отражает идею единства человека и природы: гром и шум природы ""вторят весело громам"", что указывает на то, что природа отзывается на внутренние переживания человека, а человек, в свою очередь, чувствует себя частью этого природного процесса.

Таким образом, стихотворение не только описывает природное явление, но и выражает глубокое философское отношение к жизни и её изменчивости."
