author,name,queries,LLM1,LLM_RAG1,LLM2,LLM_RAG2,LLM3,LLM_RAG3
Владимир Маяковский,Послушайте!,"Напиши краткий анализ стихотворения Владимира Маяковского ""Послушайте!"" на основе его размера, рифмы и основной мысли","Стихотворение Владимира Маяковского ""Послушайте!"" написано в свободном стихе, что позволяет автору использовать разнообразные размеры строк, создавая динамичный и энергичный ритм. Это соответствует общей идее произведения, где Маяковский стремится привлечь внимание читателя и вызвать у него эмоциональную реакцию.

В плане рифмы, стихотворение характеризуется ассонансами и аллитерациями, что добавляет музыкальности и подчеркивает важность ключевых слов. Например, повторение звука ""с"" в строках ""Скажите мне, товарищ, / Что вы видите в этом?"" усиливает ощущение настойчивости и требовательности.

Основная мысль стихотворения заключается в призыве к действию, в необходимости изменить мир и бороться за свои идеалы. Маяковский использует сильные, выразительные образы, чтобы подчеркнуть свою позицию: ""Я вас молю, товарищ, / Скажите мне, что делать?"". Эти строки выражают внутреннюю борьбу и поиск смысла в окружающем мире, призывая слушателя к активному участию в общественной жизни.

Таким образом, структурные особенности стихотворения, такие как свободный размер и использование звуковых эффектов, служат средством усиления основной идеи о необходимости коллективного действия и изменения мира.","Стихотворение Владимира Маяковского ""Послушайте!"" написано в свободном стихе, что характерно для авангардного направления, в котором он работал. Размер стихотворения нерегулярный, с чередованием строк разной длины, что подчеркивает эмоциональную насыщенность текста. Рифма также нерегулярная, преимущественно перекрестная и неполная, что создает динамичный и неожиданный ритм.

Основная мысль стихотворения заключается в вопросе о смысле и значении таких явлений, как звезды, которые, по мнению Маяковского, не просто существуют, но и ""зажигаются"" для какой-то высшей цели. Поэт задается вопросом, зачем нужны звезды, если они являются лишь символами надежды и желания для человека. Основной акцент делается на человеческом стремлении к свету и красоте, даже если это стремление кажется абсурдным или ненужным с точки зрения логики.

Центральная часть стихотворения описывает историю человека, который готов на все ради звезды, что символизирует его внутреннюю потребность в чем-то большем. Это создает контраст между внешней твердостью и внутренней уязвимостью человека, показывая, как глубоко укоренено в нас стремление к чему-то прекрасному и недосягаемому.

Таким образом, стихотворение поднимает вопросы о значении искусства, веры и человеческих желаний, используя простые, но мощные образы и эмоционально насыщенный язык. Оно приглашает читателя задуматься о том, зачем мы ищем смысл в вещах, которые кажутся незначительными или даже бессмысленными.","Стихотворение Владимира Маяковского ""Послушайте!"" написано в жанре политической сатиры и обращено к читателю с призывом обратить внимание на социальные проблемы. Размер стихотворения — свободный, что характерно для футуризма, который стремился освободиться от традиционных форм. Это позволяет поэту использовать разнообразные ритмические структуры, подчеркивая динамику и напряженность произведения.

### Размер и рифма:
- **Размер**: Свободный стих, без строгой метрической структуры. Маяковский использует различные размеры строк, что создает эффект непрерывного движения и усиливает эмоциональное воздействие текста.
- **Рифма**: В стихотворении преобладает парная рифма, которая придает тексту определенную музыкальность и упорядоченность, несмотря на общую свободу формы.

### Основная мысль:
Основная мысль стихотворения заключается в призыве к общественному пробуждению и борьбе за социальную справедливость. Маяковский обращает внимание на несправедливость и лицемерие окружающего мира, используя сатиру и яркие образы, чтобы побудить читателя к действию. Он призывает людей не оставаться равнодушными к проблемам общества и активно участвовать в их решении.

В стихотворении звучит лозунг ""Послушайте!"", который становится своего рода призывом к мобилизации и объединению людей вокруг важных социальных вопросов. Маяковский использует сильные, выразительные образы и метафоры, чтобы подчеркнуть свою мысль и вызвать у читателя эмоциональный отклик.","Стихотворение Владимира Маяковского ""Послушайте!"" написано в свободной форме, что характерно для его творчества. Размер стихотворения не поддается четкой классификации, так как Маяковский часто отходил от традиционных метрических структур, предпочитая более разнообразные и динамичные ритмические решения. Это создает ощущение естественного потока мыслей и эмоций.

Что касается рифмы, то в стихотворении используется смешанная система рифмования. В первой части заметна чередующаяся рифма (ABAB), которая затем переходит в более свободную и нерегулярную схему. Такое использование рифмы подчеркивает стремление Маяковского к выразительности и индивидуальности, избегая шаблонов и предсказуемости.

Основная мысль стихотворения заключается в том, что даже самые простые и, казалось бы, бессмысленные вещи, такие как звезды, имеют свою значимость и предназначение. Маяковский задает вопрос: ""Зачем нужны звезды?"" и через метафору звезд, которые ""зажигают"", поднимает вопрос о смысле существования и роли каждого человека в этом мире. Он показывает, что даже самые маленькие и, возможно, незаметные действия или желания могут иметь глубокий смысл и значение.

Стихотворение также акцентирует внимание на человеческом стремлении к чему-то большему, к надежде и вере, даже когда кажется, что все потеряно. Образ человека, который ""врывается к богу"" и ""просит, чтобы обязательно была звезда"", символизирует человеческое стремление к свету и утешению в трудные времена. Это создает ощущение надежды и устойчивости перед лицом жизненных испытаний.

Таким образом, ""Послушайте!"" можно рассматривать как философское размышление о значении и предназначении жизни, выраженное через призму простого и доступного образа звезды.","Владимир Маяковский в своём стихотворении ""Послушайте!"" использует свободный стих, что позволяет ему экспериментировать с формой и ритмом, создавая динамичное и энергичное звучание. Размер стихотворения нерегулярный, с чередованием строк разной длины, что подчёркивает спонтанность и импульсивность высказывания.

Что касается рифмы, она также нерегулярна и часто ассонансная, что придаёт стихотворению мелодичность и делает его более запоминающимся. Отсутствие строгой схемы рифмовки усиливает ощущение живого диалога и напряжённости, передавая атмосферу уличного выступления.

Основная мысль стихотворения заключается в призыве к действию, к переменам и борьбе за справедливость. Маяковский использует яркие метафоры и образы, чтобы подчеркнуть необходимость преобразований в обществе. Он обращается к слушателям с резкостью и настойчивостью, призывая их не просто слушать, но и действовать, принимать участие в изменении мира вокруг.

Примеры строк, иллюстрирующих эти особенности:

- ""Послушайте! Я кричу вам в лицо...""
- ""Где же ваша воля? Где ваши руки?""
- ""Дайте мне революцию!""

Эти строки демонстрируют как динамичный ритм, так и призыв к активному участию, характерный для всего стихотворения.","Стихотворение Владимира Маяковского ""Послушайте!"" написано в размере ямба, что придает тексту динамичность и ритмичность. Строка состоит из четырех слогов, чередующихся ударными и безударными, создавая четкий и энергичный ритм.

Что касается рифмы, то в стихотворении используется перекрестная рифма (ABAB), что придает тексту мелодичность и связность. Это способствует легкому восприятию и запоминанию стихотворения.

Основная мысль произведения заключается в вопросе о смысле существования и роли каждого элемента в мире. Маяковский задает вопрос: ""Зачем нужны звезды?"", подразумевая, что даже кажущиеся бессмысленными явления имеют свою ценность. Он показывает, как человек, увидевший звезду, готов на все, чтобы она оставалась в небе, что символизирует стремление к свету, надежде и красоте. В стихотворении выражена идея о том, что каждая звезда, как и каждый человек, имеет свое предназначение, и ее свет необходим для того, чтобы освещать мир и вдохновлять других.

Таким образом, ""Послушайте!"" становится призывом к осознанию значимости каждого момента и каждого действия, ведь даже самые маленькие и, казалось бы, незначительные вещи могут иметь глубокий смысл."
